id,title,content
23489,Gretchen Carlson Suit Aims at Retaliation Over Discrimination - The New York Times,"In the complaint that Gretchen Carlson, the former Fox News anchor, filed this week against Roger Ailes, the network’s chairman, one thing stands out above all: the overtness of the sexual harassment that Ms. Carlson says she endured. “I think you and I should have had a sexual relationship a long time ago and then you’d be good and better and I’d be good and better,” Mr. Ailes told her last year, according to the complaint. And yet the legal case Ms. Carlson has built is based largely on her claims of Mr. Ailes’s retaliation against her for standing up to him, not the underlying discrimination. “Definitely the primary complaint is that she has been retaliated against by rebuffing his demands, complaining about discrimination,” Nancy Erika Smith, Ms. Carlson’s lead lawyer, said in an interview. In fashioning their arguments this way, Ms. Carlson and Ms. Smith epitomize a stark trend in discrimination cases over the last decade or two: More and more workers are bringing retaliation claims, and those claims, in turn, often determine the outcome of their cases. So pronounced is this practice that proving retaliation has sometimes displaced attempts to remedy the discriminatory treatment itself, a development that concerns some legal experts. “A lot of companies would find it easier to deal with the problem of retaliation, as opposed to addressing these underlying problems of harassment  —   denying promotions, paying lower wages because of sex,” said Peter   of the Washington Lawyers’ Committee for Civil Rights and Urban Affairs. According to data compiled by the Equal Employment Opportunity Commission, charges of retaliation linked to discrimination claims more than doubled from 1997 to 2015, to just under 40, 000, overtaking charges of racial discrimination, which had previously been the most common E. E. O. C. charge. One reason for the trend may be a pair of Supreme Court rulings in the late 1990s that prompted employers to enact policies that encourage workers to come forward when they believe they have suffered discrimination. But, of course, any uptick in workers speaking up also creates more risk that their bosses will retaliate against them for doing so, said Carolyn Wheeler, a longtime E. E. O. C. lawyer now at the firm Katz, Marshall  Banks in Washington. In recent years, the commission has also made a priority of combating retaliation, Ms. Wheeler said, for the simple reason that it can fulfill its mission only if “people aren’t afraid to bring discrimination to the attention of the agency. ” Perhaps most important, however, is the fact that it is often easier to win a retaliation claim than a case about the original discrimination, and it has become more so in recent years. The Supreme Court in 2006 made it easier to prove that an employer’s response was serious enough to constitute retaliation, instead of being able to win only when an employee suffered an unambiguously harsh consequence for speaking up, like being fired. Anything that might well have discouraged a reasonable person from coming forward, like a schedule that makes it tough to care for one’s children, could suffice. Ms. Smith, the lawyer in the Carlson case, adds that retaliation claims can be more intuitive, because the desire to punish an accuser is almost universal. By contrast, discrimination claims may involve comments or actions that not everyone will view as hostile or demeaning. “I do think it’s absolutely true that it’s easier for juries to get retaliation,” she said. “It’s easier for even men to understand retaliation in a case. Maybe women might understand more how damaging this environment is. ” There is evidence to support this. Cynthia Calvert, a discrimination lawyer and senior adviser at the Center for WorkLife Law in San Francisco, recently reviewed 4, 400 cases involving workers who believed their employers had discriminated against them because of their role as caregivers, such as mothers of newborns. Ms. Calvert said that although many employees would file both discrimination and retaliation claims, “not infrequently, the discrimination claim would be dismissed in summary judgment, but the retaliation claim would remain. ” “The end result,” she said, “is that we probably have more verdicts and settlement on retaliation than on the underlying claim. ” In one  prominent case in May, a sheriff’s sergeant in Sacramento won an award of more than $3 million when the jury found that her superiors had retaliated against her for complaining of discrimination. The discrimination claims had been dismissed. (Other lawyers note that retaliation claims can fail when the alleged retaliation comes a considerable time after the plaintiff first complained of discrimination, so this approach is hardly bulletproof.) The trend has its downsides, however, if the goal is to root out and address actual discrimination. “The whole point of this is, if there’s wrongdoing in a workplace, you want to make sure an employer understands what it is and corrects it so that it doesn’t go on in the future,” Ms. Calvert said. If the focus is primarily on retaliation, “you’re not getting that effect. ” In the extreme situation, aggressively policing retaliation but setting a dauntingly high bar for many types of discrimination claims could have the odd effect of making it relatively easy for workers to confront their employers while giving those employers little incentive to change certain corrosive practices. It would be akin to protecting corporate and government   while leaving intact barriers to prosecuting corruption. To truly root out discriminatory behavior, many experts say, it must become easier for victims to gain redress legally. For example, courts frequently require plaintiffs to show that a similar employee was treated differently  —   say, a woman claiming that she was denied promotion because of gender discrimination would need to show that a similarly productive man with the same duties and qualifications received the promotion. But such airtight comparisons frequently do not exist, particularly at smaller companies. More broadly, courts grappling with discrimination cases are often laboring under a standard that favors direct evidence  —   like explicitly sexist or racist comments  —   that emerged almost two generations ago. In those days, bias was frequently overt. Today, biases tend to be more subtle and unconscious, like employers believing they are treating different workers equally even when they are not. “‘We don’t hire people like you’ was the world of the 1960s and 1970s, and the courts came up with ways of proving discrimination of that sort,” said Ms. Wheeler, the former E. E. O. C. lawyer. “That doesn’t help very much for plaintiffs today. ”"
20024,Getting Workers to Save More for Retirement - The New York Times,"Saving for retirement should be simple arithmetic  —   the longer your money has to grow, the more money you should have when you stop working. But saving today for a distant tomorrow isn’t so simple, and has a great deal to do with how people think about money. Sean Furlong, the director of finance and administration at Gilman School, a private secondary school in Baltimore, said he realized that while teaching a business class. He was teaching students, he said, “but then I realized I wasn’t teaching my faculty and staff. ” “They didn’t know the things I was teaching to high school students,” he added. “Many of them had missed that. ” Mr. Furlong said he decided to ask the school for permission to begin a retirement education program. Its goal was to increase participation in its retirement plan and to educate people on thinking about their savings choices and investment options. Nearly five years after Mr. Furlong pushed for that education campaign, the school has an average contribution rate of 22 percent, up from 16 percent. (This includes Gilman’s 8 percent match after participants contribute the first 7 percent of their salary.) At the highest end, people are contributing 35 percent of their salary. Changing how people think about the money they save for retirement is one of the central tenets of a movement that is based on behavioral finance, the approach to economics that aims to understand how average people, not rational economists, make financial decisions. After all, it’s the way people behave around money that tends to derail their plans, not a lack of knowledge about what they need to do if they want to retire comfortably. “The biggest challenge is not saving enough,” said Liz Davidson, founder and chief executive of the consultancy Financial Finesse and author of “What Your Financial Advisor Isn’t Telling You. ” “Historically, there’s been a lot of focus on returns. The return is on what you save, and most people aren’t saving enough. ” Ms. Davidson, whose consultancy works with companies on their financial plans for employees, said that when it came to retirement, her company tried to get employees to think about how much they could set aside each day, and to forget about a larger monthly or annual number. “Most people can save a few dollars a day or even $10 a day,” she said. “That’s doable. But if you say, ‘Can you save $300 a month or a couple of thousand dollars a year?’ people will say, ‘Whoa.’ ” Avoiding that “whoa,” which is the hesitancy that can derail planning, is what consultants like Ms. Davidson are trying to do. Just as saving a bit more today is going to pay off in the future, not saving enough, failing to participate in a retirement plan or taking money out of a plan too early can significantly reduce the amount of money available decades later. Many of these efforts come back to seminal work by Shlomo Benartzi and Richard H. Thaler, behavioral economists who have researched how to get people to be better retirement savers. One of their conclusions is people need to be nudged by employers to stay on track, often in ways that keep them from missing the money they are saving. These strategies include automatically enrolling people in retirement plans, asking whether they would like to increase their contributions when they receive a raise and limiting the investment choices so they would need to opt out of a broadly diversified portfolio, which is likely to produce the best returns over time. As simple as the nudges seem, they have been proved to work. The National Football League’s Players Association, which represents current and former players, moved to automatically enroll its players in 2007. Since then the participation rate has gone to 90 percent, from 82 percent. “You don’t miss what you don’t have,” said Dana Hammonds, senior director of player affairs and development. At Gilman School, Mr. Furlong pushed to limit the number of investment options, cutting the funds its plan offered by 75 percent, while increasing the education about the ones that were available. “It used to be faculty and staff could be invested 100 percent in commodities funds and no one would care,” Mr. Furlong said. “Now the majority are in target date funds. ” (Target date funds are set up so that the allocation of a person’s investment changes as the person gets older.) Increasing the amount people contribute has also been a challenge. The default rate used to be 3 percent, which wasn’t enough, said Aimee R. DeCamillo, head of retirement plan services at T. Rowe Price, which provides plans for two million people at 3, 500 companies. She said a savings rate closer to 15 percent, including the employer match, was better. One way it gets people closer to that number is to use behavioral finance tricks with its online portal. This comes into play with increasing the contribution rate. “If you’re at 10 percent, we’ll show you 13, 15, and 17 percent, knowing you’ll go for that middle number,” she said. “It’s driving behavior in the right direction. ” Another feature is what T. Rowe Price calls its “confidence number,” which aims to predict the likelihood that you will be able to replicate your salary in retirement. “It drives you to an experience where you change assumptions,” Ms. DeCamillo said. “You can change your retirement age. You can adjust your salary you can pull in additional outside assets. It helps you build confidence that you have this control over the outcome. ” Aetna, which has worked with Financial Finesse to develop its workplace program, began a yearlong initiative this month called Retirement Ready. Its goal is to help employees think about what they are saving but also about what that money might be used for in retirement. “It’s about financial readiness but also the emotional and physical readiness for retirement,” said Kay Mooney, vice president for benefits at Aetna. “It’s critical for   employees who service our customers. We know the business is challenged if our employees are stressed financially. ” Ms. Mooney said the company would measure the program’s effectiveness based on how employees changed behaviors, like increasing contributions to their 401( k) plans or reducing their credit card debt. But success might also start by getting people to rethink what their retirement savings are for. “Financial independence is a phrase we found resonated very well,” Ms. Davidson said. “It’s living life on your own terms. Flexibility is very important. ”"
19534,John Mayer Knows He Messed Up. He Wants Another Chance. - The New York Times,"LOS ANGELES  —   John Mayer can explain where he’s been. In fact, once he gets going, he probably won’t stop, given the amount of time he has spent in private processing his recent   irrelevance  —   the “lean years,” as he calls them. A generational guitar talent and reliable   hitmaker with seven Grammys, Mr. Mayer is also a master conversationalist prone to verbal solos, noodling in impressionistic bursts about his nature and career, weaving in   potential   bits and a barrage of mixed metaphors as if he’s writing this story himself. That’s what got him into trouble in the first place. “The elephant in the room is that we’re sort of talking about the   dragon of the Rolling Stone interview and the Playboy interview,” Mr. Mayer said a   into a monologue about why he left pop music’s   and how ready he is, emotionally and musically, to return. Across four hectic days this month, as Mr. Mayer, lucid and optimistic, finished his   new album, “The Search for Everything,” and filmed a music video for what he hopes will be his next hit single, he seemed to especially relish reflecting on his 2010 undoing. Recalling the consequences of those infamous magazine articles  —   in which he used the phrase “sexual napalm,” chronicled his onanism in horrific detail, referred to his male anatomy as David Duke and somehow separately used a racial epithet  —   Mr. Mayer was vivid and virtuosic in his  . “What has to happen for a guy to believe that he’s totally   and be that far out of touch?” he said. “My GPS was shattered, just shattered. ” At 32 and obsessed with outsmarting the idea of a “clichéd rock star,” he explained, “I started to invent my own grenade. ” (His big mouth.) He was “a Mack Truck without brakes. ” Tabloid fame was “a   hormone” and “extracurricular stuff” anyway, Mr. Mayer said. “I basically realized I’m no good at that, so I’m going to drop that major. ” Also: “What I did was probably semiconsciously just reboot it  —   control, alt, delete. ” “It was an induced coma. ” His career had “flatlined. ” “It was cat and mouse,” he said, “and the mouse lost. ” Now approaching 40, “I’m old enough to look back on my life and go: ‘That’s probably the photonegative shot in ‘Behind the Music,’” Mr. Mayer said. “Coming up after the break  —   boom  —   the downfall. ” In reality, after those turbulent moments he moved to Montana, grew out his hair and made two more   albums  —   “Born and Raised” and “Paradise Valley”  —   that were less “Your Body Is a Wonderland” and more Laurel Canyon. “It’s rivers and cows,” he said. “There’s no sexuality there. ” The relatively modest sales reflected that. But the exile couldn’t last, not for this restless   with the baby face and a penchant for dating some of the most famous women in the world (Jennifer Aniston, Taylor Swift, Katy Perry). In late 2014, as he began writing what would become “The Search for Everything,” out April 14, Mr. Mayer realized: “I’m a young guy. I like girls. I want girls to like me. I want to make music and be thought of as attractive. I was finally ready to   that world and grow back into it. ” He thought a lot about George Clooney. “There’s a guy who can make art house films and then just decide that he’s going to be in a blockbuster,” Mr. Mayer said. “I remember thinking to myself, O. K. I’m going to basically come out of retirement from blockbusters. It’s a choice to write pop songs, just like it’s a choice to write blues songs or folk songs. Let’s write the big ones that we are capable of writing. ” And that’s how John Mayer ended up dancing with pandas. In sweats at a Hollywood soundstage, Mr. Mayer was quick to pick up the choreography for the ensemble number that would be the centerpiece for his new video. The song, “Still Feel Like Your Man,” is throwback for him: a wistful but upbeat breakup ditty that, like much of his new music, “moves and throbs and has women in it again,” Mr. Mayer said. It’s also pretty plainly about missing his most recent ex, Ms. Perry, a fact that he acknowledged might get the tabloids chirping again. “Who else would I be thinking about?” he said. “And by the way, it’s a testament to the fact that I have not dated a lot of people in the last five, six years. That was my only relationship. So it’s like, give me this, people. ” For the video, Mr. Mayer wanted to think big, giving the track the best chance to succeed as a single. The syncopation of the guitar riff, he said, reminded him of “ancient Japanese RB”  —   which he acknowledged “isn’t a thing”  —   so the video concept followed suit. “I’m not gonna ever roll around in bedsheets again,” Mr. Mayer added. On set the next day, there was a makeshift bamboo forest, a woman in full geisha garb and two people in giant panda suits, making up a bizarre tableau that Mr. Mayer called a “disco dojo. ” Yet for someone so attuned to the risk of offending people again  —   “I have nightmares about a second occurrence of” the Playboy era, he said  —   Mr. Mayer seemed sanguine about the possibility of a controversy over cultural appropriation, an issue that has dogged other pop stars. “I think we were as sensitive as we could possibly be,” he said over burgers at the Polo Lounge the day after the video shoot. “It was discussed at every juncture. ” “Part of cultural appropriation is blindness,” he added. “I’m on the right side of the line because it’s an idea for the video that has a very multiethnic casting, and nobody who is white or   is playing an Asian person. ” The video’s director, who goes by Mister Whitmore, said he and Mr. Mayer “thought long and hard about how to approach” the “fantasy element” of the concept without offending. “I hope there’s an understanding that we were sensitive to it,” he said. Still, Mr. Mayer acknowledged the current discourse. “Do I think that someone is going to tweet that this is cultural appropriation? Yes,” Mr. Mayer, an internet obsessive, said. “It’s going to be interesting to see. ” (And then there’s the dancing.) The song’s commercial prospects are a separate concern. In Mr. Mayer’s absence from the Top 40, guitars have been further silenced by electronics. Even Ed Sheeran and Shawn Mendes, Mr. Mayer’s direct descendants, work with pop songwriting teams and cover rap tracks. “I do a thing  —   I have sensibilities,” said Mr. Mayer, who has often found himself overcompensating for his pristine but often edgeless bluesy pop and coffeehouse soul. “My instincts as a musician are not exactly my instincts as a listener or a member of the world. But I believe that I am successful because I obey them. ” He added: “The only hits I’ll have left in my life  —   because there are great hit writers, but I will not go into a room with them  —   are luck songs. My record has one name in the parentheses on every song, and it’s my name. That’s important. ” Writing “The Search for Everything,” which was released in two   “waves” before its final iteration to better suit the streaming era, proved spiritually purifying for Mr. Mayer, he said. “This was the only time in my life that I was making something that I could live inside of. I’ve built a home because I needed a place to stay, not because I was into selling homes. ” While it began as a breakup album, with songs like “Moving On and Getting Over” and “Never on the Day You Leave,” it quickly transcended that. “There were times when tears came out of me, and I went, O. K. John, this is not about an     relationship. This is something more profound. ” In the last six months or so, completing the record coincided with the flipping of a biological switch  —   he called it “a chemical care package”  —   for Mr. Mayer, who recently became an uncle for the first time: He really does want to settle down. “That’s the final frontier, man. ” But as he approaches a milestone birthday, “I wish there was somebody to throw me the 40th,” Mr. Mayer said, leaning into his corniness. “I want the baby with the protective earphones” by the side of the stage. He’s even been living out of a hotel for fear of establishing another bachelor pad. “I want to say, ‘We’ll take it,’” he said, adding, “I’m right on time for my career, and I’m running late for my life. ” It’s a process. Though he’s been in therapy to work on his “attachment style” and recently quit drinking (“I’m actually very thoughtfully entering cannabis life”) Mr. Mayer is wary that his notoriety as a womanizer precedes him. “I’ve inherited a younger man’s reputation,” he said. “You can even break ‘bad boy’ into good bad boy and bad bad boy  —   I somehow managed to become a bad version of a bad boy. ” Since splitting with Ms. Perry, he’s hardly been out at all, he insisted, though he does fiddle around on an exclusive dating app. “It’s just a lot of chatter,” he said. “We all talk to the same people. There are very few people actually meeting up. ” Another hurdle is that he will be on tour most of the year, headlining arenas in support of the album  —   he plays Madison Square Garden on April 5  —   plus a jaunt with his side gig, Dead  Company, where he plays guitar alongside members of the Grateful Dead. (“The feeling of inclusion that I have with this band  —   they saved my life,” he said.) The itinerant lifestyle, though, is less fraught than whatever lurks in the   recesses of Mr. Mayer’s soul, depths he is beyond game to probe and excavate. “In the Blood,” the most fully formed, Tom   track from “The Search for Everything,” is a sort of   with Mr. Mayer singing big questions with no answers: “It’s not pretty, those words,” Mr. Mayer said in the studio as he worked on final touches. “But the one thing I look forward to the most as I   this level of the music world is I really want to experience saying something that I can defend no matter what. “It’s like: ‘John, they’re gonna come after you. They’re going to ask about it,’” he said with a cackle. “I say, ‘Let ‘em. ’”"
