id,title,content
19388,"The Battle of ‘Miss Saigon’: Yellowface, Art and Opportunity - The New York Times","“Miss Saigon” started with an audacious idea  —   create a musical that explores the end of the Vietnam War through an   romance between a virginal Vietnamese bargirl and a hunky American G. I. It would become much more than that. Over 28 years, “Miss Saigon” has turned into one of the most successful hits in musical theater  —   as well as one of the most polarizing and most protested. Now, it’s back on Broadway, for the first time since 2001. It is in the same theater, tells the same operatically tragic story, and again features a hovering helicopter. But the show has changed significantly over the years, and those shifts tell another story  —   one about how much the controversy over “Miss Saigon” has affected the industry. “Miss Saigon” opened in London in 1989, with an acclaimed white British actor, Jonathan Pryce, wearing prosthetics to alter the shape of his eyes and makeup to alter the color of his skin as he played the show’s leading man, a scheming Eurasian pimp called the Engineer. But by the time the show reached Broadway in 1991, Mr. Pryce had abandoned those practices, and, after he won a Tony Award and left the show, the producers changed their approach  —   in the years since, they have chosen only actors of Asian heritage to play the Engineer, both on Broadway and on the United States tours. Not every controversy has been calmed. The show’s critics, who tried and failed to stop the initial production and have periodically protested it since, say the production perpetuates an unwelcome view of Asians. Here, in edited excerpts, more than 20 people whose lives have been touched by “Miss Saigon”  —   as producers and protesters, artists and activists  —   talk about their views, then and now.   Schönberg (composer) One afternoon I was working on the score of “Les Misérables” in Paris, and I opened a magazine, and I saw a picture that really struck me. It was a young girl at the airport (in Vietnam) facing her mother. The mother had been looking for her   a G. I. and she wanted to send the girl to the United States for a better future. The mother did exactly the same sacrifice as    in “Madama Butterfly,” who committed suicide to force the American, Pinkerton, to take their boy with him. So I called Alain, and said, “Imagine the story of ‘Butterfly,’ happening at the end of the Vietnam War. ” Alain Boublil (lyricist) We got quickly to the idea that the misunderstanding between two people reflected the misunderstanding between two countries. Cameron Mackintosh (producer) This was a very dangerous, but exciting, subject. This was 14 years after a traumatic war that they’d written this, so it wasn’t obvious stuff for a musical. I remember saying, this subject matter is like dancing on a razor blade: a brilliant feat if you can pull it off. Mackintosh I’d seen Jonathan in several performances, including “The Seagull,” and then, when Michael Crawford had opened (in “The Phantom of the Opera”) in ’86 in London, Jonathan rang me out of the blue and said, “Look, I’d like to have a crack at the Phantom. ” It never got any further than that, but I remembered it. And when we had our first conversations in London with the authors and Nick Hytner (the director) I threw his name in the hopper. The entire audition process, we never saw anyone else. Frank Rich (then the chief theater critic at The New York Times) He was, and still is, a great actor  —   it would have been a coup for a musical to get him. Jon Jon Briones (member of the original London ensemble now playing the Engineer on Broadway) I came from the Philippines, and we were used to yellowface, and how white actors play Asian roles, because we watched Hollywood movies all the time. We thought that was a normal thing. Marc Oka (member of the original Broadway ensemble) I went to see it in London, and I loved the show  —   it was a show with Asian people, and I was in the business, so I thought maybe I could be in it. But I was way up in the balcony, so I didn’t see him up close. Then I saw an article in a magazine about Jonathan Pryce, and I saw a picture of him in the show, and he was wearing those prosthetics on his eyes to look Asian, and that was the first time I said there was something wrong. BD Wong (  actor) I first heard about the show in a conversation with the playwright David Henry Hwang. He and I were really fresh off of doing this reasonably successful play (“M. Butterfly”) in which the whole notion of “Madama Butterfly” is turned on its head. He was reporting, in a kind of amused way, about this show in the West End, with these two guys in yellowface (the Engineer and Thuy, Kim’s cousin). We said, surely the show will come to the United States, but the yellowface will never happen here, because that’s the kind of thing that only happens in England now. Lea Salonga (actress who played Kim, the bargirl, in the original London and Broadway productions) I was in Manila, and in my freshman year at college  —   I was  . I was 17, and I was very innocent. I didn’t know what a bargirl was. And my concerns were less about that than some of the skimpy costumes I had to wear  —   I grew up pretty conservative. I called my father, and said, “What am I going to do?” and he said, “They’re not going to remember that. They’re going to remember when you shoot yourself at the end. ” And I guess he was right. Wong Much to our surprise, there was an announcement that Jonathan Pryce was coming. So I wrote a letter to the actors’ union, which had to approve the visa, even for a star coming over. After decades of Caucasian actors impersonating Asian characters in television, movies and in the theater, with a certain amount of comfort from audiences at large, it finally became absolutely essential for the   audience community and the   acting community to say it’s too painful for us to watch this anymore  —   we can’t take it any more, it embarrasses us, and it’s humiliating. Rich I’m completely sympathetic, and argue further that   actors have a particularly raw deal  —   there are so few opportunities for them compared to other minorities, let alone majorities. But I still feel a director has the right to do what he wants to do. Tisa Chang (artistic producing director, Pan Asian Repertory Theater) This was not the 1970s, when there was a protest against Lincoln Center for casting “Narrow Road to Deep North” with no Asian actors whatsoever  —   and it was a play about Japan. This was 1990, and a lot of work had been done already. Our position was not to be inflammatory, but it was a cri de coeur in response to what their team had said, which was that there was no   actor qualified to play the role. That really stirred the pot. Boublil It was a bit disturbing for us, because suddenly the subject of the show was not anymore the doomed love story and the mother’s ultimate sacrifice, which is what we had written. Suddenly the subject was casting controversy. I remember even some journalist in a magazine who said, “Don’t let this show come to this country. It’s going to destroy the fabric of the country. ” Wong In this really dramatic, theatrical way, Equity voted to deny Jonathan Pryce his visa. Mackintosh I was just astonished. And it got, as you know, quite sticky. At that point, even though we had the biggest advance in history, I said, look, if the show isn’t going to come here with the performances that made it so fantastic in London, I’d rather it didn’t move at all. I canceled it. Wong Equity had a real problem on its hands. The membership was divided. Some people thought it was absurd to make an issue of the race of a person. And the pressure came from other places. There was a lot of   stuff. The mayor of New York (David Dinkins) really wanted the show to come in. A few days later, Equity rescinded its decision. It was profoundly sad. I remember feeling so misunderstood. Ralph B. Peña (producing artistic director,   Theater Company) I protested, but I thought I should know what I’m protesting against, and also I needed to see what they did, because they had removed Jonathan Pryce’s yellowface. So I saw it on Broadway, and it was glorious. And then it hits you  —   what did I just experience? And then it’s awful. But I had never seen a helicopter land on Broadway before, and I was mesmerized by the music and the stagecraft, and also the pride that I felt at seeing Lea nail that role on Broadway. That was something else. Esther Kim Lee (associate professor of theater, University of Maryland) I saw the taped version at New York Public Library, and I was most interested in the Jonathan Pryce character, despite the fact that I was completely criticizing him. I was surprised to see how good he was. Rich It was a fantastic performance. Tara Rubin (casting director) After Jonathan Pryce, who was absolutely brilliant in the role, there was never another Caucasian person who played the part in this country. We knew that the   acting community had an incredibly good point, and it was the beginning of a huge shift in the way we think about casting. And I can’t help but wonder if the increased opportunity has helped increase the number of   actors who enter the field. Manu Narayan (actor in second national tour) With all the trouble they had had  —   and rightfully so  —   casting Jonathan Pryce, the total turnaround they then did to make sure Asians were cast in the roles going forward is a testament to Cameron Mackintosh. It doesn’t negate what happened, but a lot of people wouldn’t have seen that error. In 1995, I had gone to New York for a wedding, and in Backstage I saw an open call for Chrises and Johns, so I went and stood in line and danced on the Broadway stage. I was cast in the ensemble for the national tour and stayed for four years. Raul Aranas (actor in multiple productions) I can safely say I’ve done over 2, 000 performances as the Engineer  —   I did it for the first national tour, and then they moved me to Broadway, and then Cameron offered me London, and then I   on Broadway and did a few venues that were not as large. And after this, I did “The King and I” I did “Pacific Overtures” I did “Flower Drum Song” and I did “Oliver. ” “Miss Saigon” enabled me to save enough money to have a nest egg, start a family and find a home, and now I’m retired  —   another thing “Miss Saigon” enabled me to do is have a great pension. Margaret Ann Gates (actress in multiple productions) I heard that they were looking for actual Asians to be in the show  —   not people who were   and I went into the ensemble a month or two after graduating from college. Then they offered me the role of Ellen (an American woman who marries a returning G. I.) in 1998. I was the first Asian to hold the role, and when I started, people were like, “That’s not right! Ellen’s supposed to be white!” which of course is ridiculous  —   just because somebody is American doesn’t mean she has to be white.  Ethan Thoi (actor in Australian production) I couldn’t believe there was a musical about Vietnam, where I was born. I was born in 1973, and my mom had some involvement with a Western guy at that time  —   her pregnancy was not accepted, and she had to give me away. In 2007, when the show came to Sydney, I was lucky to be in the ensemble. I did the whole national tour (in Australia)  —   about 14 months  —   and every night I was crying at the part where she sings, “I’d give my life for you,” and crying at the part where the refugees are climbing up the walls, because I was also a refugee, from Vietnam to Australia. Pun Bandhu (actor active with Asian American Performers Action Coalition) There continue to be protests against “Miss Saigon” across the country, and I think that’s because the Asian community is so tired of seeing ourselves portrayed in one way. In many ways, “Miss Saigon” is a colonial story, where none of the Asian characters are portrayed in a positive light  —   yes, they are victims of a war, but they are also characterized as opportunists, villainous, and, at the center of the story, Kim is written to be very weak. Oka It turned into a political protest about the portrayal of Asian women on the stage. I remember one night, during the second act, when the Bangkok number happened, protesters were screaming and shouting from the audience, and they were led out. Salonga I have friends who were on the other side of that controversy, and I do understand what they were fighting for, but you do realize the whole prostitution thing lasts 15 minutes, and the show is 2½ hours long? And you can rally and rail against Asian women as prostitutes, but you can’t erase history. This is set in 1975, not in 2017, and this really happened. I’m from Manila, and it still happens. Go to any   district, and that’s what you see: a girl with desperation in her eyes, wanting to not be doing this, and another girl who is dead on the inside. I don’t know of too many shows that allow the audience to see that reality. It’s very   and can be quite jarring. Will Chase (actor who played Chris, the G. I. in multiple productions) I used to make fun of it when I was a longhaired percussionist at Oberlin College. Then I did three years in the show. And over the course of doing it, we would have Vietnam vets come talk to the cast. I started to pay attention to it in a different way. One guy said when he got back home he would wake up in the middle of the night with a gun, ready to blow his brains out, night after night, and the show was cathartic for him. He came once a week. Those kinds of stories made me grow up in the show. Ralph B. Peña One of the songs  —   the marriage song, I found out later  —   was gobbledegook, not even real Vietnamese. The new version has changed those lyrics to real Vietnamese words, which is some recognition that they can’t get away with what they got away with in 1990. Marc Thibodeau (longtime “Miss Saigon” publicist) The first week of rehearsals (for the Broadway revival) Alain Boublil met with Christopher Vo, a Vietnamese cast member, who suggested some rewording on the wedding blessing to make it genuine and to make sense. Alain took his suggestion, and it went into the show early in rehearsals and has been part of the show in previews. Laurence Connor (revival director) My memory of the original is it felt so big and epic and operatic. I wanted to make it real  —   I wanted to set up a sense of grit within the production. Rachelle Ann Go (actress playing Gigi in revival) Our first two days of rehearsals in London, we were in a room, watching so many documentaries about the war. It was so heartbreaking. Eva Noblezada (actress playing Kim in  revival) I’d never seen the show. I didn’t know what happened until I read the script when I was cast. I was like, “Oh my goodness, this is epic. ” I’m a prostitute in this, and it’s not glamorous, it’s not pretty. It is demeaning. But this happened to real people. And the refugee scene  —   that’s relevant today. Being a victim of war and being a victim of confused leadership  —   that is relevant today. Briones I’ve been doing this on and off for a while  —   the Asian tour and the American tour and the U. K. tour, and in Germany, where I met my wife  —   she was playing Ellen. I first encountered “Miss Saigon” in 1988, when they came back to Manila to cast the male ensemble, and I auditioned. I was 22, and left the Philippines for the first time. And now, for me to be playing the Engineer on the biggest stage of all, it’s an honor and it’s a responsibility. I truly believe that, because of “Miss Saigon,” Asian actors are seen in a different light."
26182,It’s Donald Trump’s Party Now - The New York Times,"The Republican Party’s trek into the darkness took a fateful step in Indiana on Tuesday. The Hoosier State delivered an    victory to Donald Trump, who beat Ted Cruz soundly in the state, sweeping up at least 51 delegates. On the Democratic side, Bernie Sanders won an unexpected victory over Hillary Clinton, though it was not enough to halt her march to the nomination. Shortly after the Republican race was called, Mr. Cruz announced that he was ending his campaign, leaving Gov. John Kasich as the sole rival to Mr. Trump in the G. O. P. contest. That the   had hoped to fall back on Mr. Cruz, perhaps the most reviled politician in his party, was a measure of their panic about the prospect now before them. With Mr. Trump’s success, “I’m watching a    political party commit suicide,” said Henry Olsen, an elections analyst with the Ethics and Public Policy Center, a conservative think tank. Republicans will all but certainly nominate Mr. Trump, who would be the most volatile and least prepared presidential candidate nominated by a major party in modern times. A man once ridiculed by many prominent Republicans will become the G. O. P.  . This is a moment of reckoning for the Republican Party. It’s incumbent on its leadership to account for the failures and betrayals that led to this, and find a better way to address them than the demagogy on offer. Republicans haven’t yet begun to grapple with this. Instead they’re falling into line. Republican leaders have for years failed to think about much of anything beyond winning the next election. Year after year, the party’s candidates promised help for   people who lost their homes, jobs and savings to recession, who lost limbs and   to war, and then did next to nothing. That Mr. Trump was able to enthrall voters by promising simply to “Make America Great Again”  —   but offering only xenophobic, isolationist or fantastical ideas  —   is testimony to how thoroughly they reject the politicians who betrayed them. Now, myopic as ever, Republican leaders are talking themselves into supporting Mr. Trump. At a party retreat in Florida last month, Mr. Trump’s adviser Paul Manafort, brought in to make the candidate seem safer to the old guard, assured them that Mr. Trump will better prepare himself for the presidency. “That was all most of these guys needed to hear,” said an operative in the room. “Maybe he’s trainable. ” But within a day, Mr. Trump was back to making vile comments at his rallies. In his confused foreign policy address, he demonstrated nothing but a willful refusal to learn. Some Republicans still seem to hope they can direct voters’ attention past the Trump candidacy. Last week in Washington, Paul Ryan, the speaker of the House, told a dismayed young Republican at Georgetown University to try not to worry so much about Mr. Trump. “I would just ask you to raise your gaze and look at the horizon that we’re trying to paint,” he said, promoting #ConfidentAmerica, his plan to create a plan. Its mission reads like this: “We do not like the direction the country is going, and we have an obligation to offer an alternative. That’s why House Republicans are developing a bold,   agenda to take to the country. By giving the people a clear choice in 2016, we can earn a mandate to do big things in 2017 and beyond. ” It is the Republicans who are making a clear choice in 2016, one that seemed unimaginable a year ago: To stamp what they still like to call the party of Lincoln with the brand of Donald Trump."
21920,"New Jersey Will Increase Gas Tax 23¢, Ending Long Political Stalemate - The New York Times","Gov. Chris Christie, who has long resisted raising any taxes, has battled with Democratic leaders since early summer over raising New Jersey’s gas tax, reaching an impasse that brought hundreds of highway and transit projects to a standstill that lasted months. But on Friday, a day after a fatal train crash in Hoboken focused attention on the troubled conditions of the   railroad, Mr. Christie, a Republican, finally gave way by accepting the first tax increase during his seven years in office. He said he had agreed to raise the gas tax by 23 cents a gallon to replenish the depleted Transportation Trust Fund, which the state uses to pay for improvements to rails, roads and bridges. Mr. Christie, who has just over one year left in his second term, has prided himself on his refusal to raise taxes and promoted his record during his campaign to be the Republican presidential candidate. But he said he made an exception for the gas tax because the need to maintain the state’s transportation infrastructure was so critical. “While I’m not authorizing any other tax increase during my time as governor,” he said, “I’m authorizing this one because of the importance of the Transportation Trust Fund, the tax fairness that we’ve accomplished together and the compromise we’ve reached, and because we need to responsibly finance this type of activity. ” Mr. Christie made the announcement at the State House in Trenton, flanked by the State Senate president, Stephen M. Sweeney, and the speaker of the State Assembly, Vincent Prieto, both Democrats. The three men each described the agreement as a   compromise. “Sorry it took so long,” Senator Sweeney said. “But we all have strong personalities, and sometimes it just takes time to get together. ” The increase could take effect as soon as next week. The Legislature has scheduled a special session for Wednesday to vote on the matter. In exchange for Mr. Christie’s acceptance of the higher gas tax, the Democrats agreed to lower the state’s sales tax by less than half a penny and to phase out the estate tax by 2018. Mr. Christie said the sales tax rate would decrease next year to 6. 875 percent, from 7 percent. In 2018, he said, it will drop again, to 6. 625 percent. He said the gas tax would pay for an   $32 billion reauthorization of the Transportation Trust Fund, adding that “$32 billion will be invested in infrastructure and improvements and modernizations in the state of New Jersey over the next eight years. ” Mr. Prieto said that the agreement “couldn’t come soon enough,” and that replenishing the transportation fund was “so important because it’s a public safety issue. ” Mr. Christie had argued for the reduction of other taxes to balance the tax burden of New Jersey residents. He had called for a 1 cent decrease in the sales tax rate, but settled for a package of cuts that would include the smaller decrease. Along with the   drop in the sales tax, the Democrats also accepted a phaseout of the state’s estate tax, an increase in the   tax credit for the working poor and a tax break for veterans. The     increase in what the state collects on fuel sales  —   currently the   rate of all the states  —   would be the first in New Jersey in nearly three decades. It was last raised in 1988, and now only Alaska’s is lower. With the proposed increase, to 37. 5 cents, New Jersey’s gas tax would be considerably higher than the national average of about 21 cents. The agreement met with immediate criticism from some advocacy groups. “These leaders have foolishly paired a big package of tax cuts that will disproportionately benefit   New Jerseyans while decimating the state’s ability to pay for essential services, promised obligations and other critical investments,” said Jon Whiten, the vice president of New Jersey Policy Perspectives. “While it is absolutely essential that New Jersey invest in its transportation infrastructure, that investment should not be held hostage to some warped idea of   tax fairness that will cost the state well over $1 billion a year,” Mr. Whiten added. “This is, quite simply, the wrong path forward for New Jersey. ” Mr. Christie said the trust fund would receive $2 billion a year for eight years, which he said would be its biggest and longest reauthorization. With federal matching funds, he said, the state would have $32 billion to spend on road and transit projects over the next eight years. The governor said the tax cuts were estimated to save the state’s taxpayers $164 million next year and as much as $1. 4 billion when they are completely in place in 2021."
